{
  "version": "mesh.cos.decision.v2",
  "decision_id": "decision-example-v2",
  "decided_at_utc": "2026-08-17T19:00:00+00:00",
  "decision_status": "DECIDED",
  "decision_type": "OPERATING_JUDGMENT",
  "decision_title": "Route pursuit analysis to CRO",
  "task_id": "T1",
  "correlation_id": "corr-1",
  "agent_id": "cos",
  "agent_role": "Executive operating control plane",
  "decision_owner": "cos",
  "authority_level": 3,
  "human_approval_required": false,
  "approval_reference": null,
  "human_approver": null,
  "decision": "Route the commercial interpretation to CRO",
  "disposition": "APPROVED",
  "decision_basis_summary": "The Agent Registry assigns commercial interpretation and pursuit strategy to CRO and the cited sources are within CRO scope.",
  "evidence_references": ["registry:cro", "task:T1"],
  "source_systems": ["Agent Registry", "TaskLedger"],
  "alternatives_considered": ["CFO", "COO", "CRO"],
  "selection_criteria": ["functional truth ownership", "delegated authority", "source permission"],
  "confidence": 0.95,
  "risk_level": "LOW",
  "affected_entities": ["cro"],
  "reversibility": "REVERSIBLE",
  "reversal_condition": "New evidence changes functional ownership or authority.",
  "policy_rule_ids": ["mesh-l3", "functional-truth-boundary"],
  "model_provider": "OpenAI",
  "model_id_version": "example-model",
  "prompt_template_version": "example-template-v1",
  "skill_agent_version": "cos-1.0.0",
  "data_classification": "INTERNAL",
  "outcome_validation": "CRO accepts assignment and returns evidence-backed commercial analysis.",
  "outcome_status": "IN_PROGRESS",
  "supersedes_decision_id": null,
  "superseded_by_decision_id": null,
  "review_due_at_utc": null,
  "retention_class": "GOVERNANCE_LONG_TERM",
  "canonical_record_ref": "TaskLedger:decision_v2:decision-example-v2",
  "record_hash": "aaaaaaaaaaaaaaaaaaaaaaaaaaaaaaaaaaaaaaaaaaaaaaaaaaaaaaaaaaaaaaaa",
  "recorded_at_utc": "2026-08-17T19:00:00+00:00"
}
